{
  "schema_version": "2026-07-19",
  "mode": "release_gate",
  "artifact_type": "workflow-walkthrough",
  "artifact_paths": [
    "artifacts/desktop-workflows/example-run/manifest.json",
    "artifacts/desktop-workflows/example-run/screenshots/01-step.png",
    "artifacts/desktop-workflows/example-run/results.json"
  ],
  "artifact_evidence": [
    {
      "path": "artifacts/desktop-workflows/example-run/manifest.json",
      "kind": "workflow-manifest",
      "status": "verified"
    },
    {
      "path": "artifacts/desktop-workflows/example-run/screenshots/01-step.png",
      "kind": "screenshot",
      "status": "verified"
    },
    {
      "path": "artifacts/desktop-workflows/example-run/results.json",
      "kind": "smoke-result",
      "status": "verified"
    }
  ],
  "artifact_freshness": "current",
  "artifact_summary": "Repeatable operator walkthrough backed by manifest, screenshots, and smoke output.",
  "persona_set": {
    "panel": "operations-controls",
    "required_roles": [
      "Operations Manager",
      "Integration Administrator"
    ]
  },
  "focus_areas": [
    "workflow_fit",
    "trust_and_controls",
    "release_readiness"
  ],
  "constraints": [
    "Do not assume undocumented steps outside the manifest."
  ],
  "success_criteria": [
    "The flow is completable without hidden prerequisites.",
    "A failure state is visible and recoverable.",
    "The operator can explain the current state at each step."
  ],
  "decision_deadline": "before the release candidate"
}
