{
  "schema_version": "2026-07-19",
  "mode": "design_partner",
  "artifact_type": "screen-review",
  "artifact_paths": [
    "docs/screenshots/desktop/example-screen.png",
    "src/Meridian.Wpf/Views/ExamplePage.xaml"
  ],
  "artifact_evidence": [
    {
      "path": "docs/screenshots/desktop/example-screen.png",
      "kind": "screenshot",
      "status": "supplied"
    },
    {
      "path": "src/Meridian.Wpf/Views/ExamplePage.xaml",
      "kind": "source",
      "status": "supplied"
    }
  ],
  "artifact_freshness": "unknown",
  "artifact_summary": "Static screen review for a WPF surface.",
  "persona_set": {
    "panel": "growth-adoption",
    "required_roles": [
      "RIA Client"
    ]
  },
  "focus_areas": [
    "first_impression",
    "workflow_fit"
  ],
  "constraints": [
    "Review what is visible in the supplied screenshots before inferring hidden behavior."
  ],
  "success_criteria": [
    "The first-time user understands what the screen is for within two minutes.",
    "The next action is obvious."
  ],
  "decision_deadline": "before UI sign-off"
}
